Category,Value,Question,Answer
Animals,800,This African animal is known for its horn and thick skin,What is the Rhinoceros?
Animals,800,This flightless bird is native to New Zealand,What is the Kiwi?
Animals,800,This insect undergoes metamorphosis from caterpillar to adult,What is the Butterfly?
Animals,800,This primate shares about 98% of its DNA with humans,What is the Chimpanzee?
Animals,1000,This bird is the heaviest capable of flight,What is the Kori Bustard?
Animals,1000,This reptile is the largest living species of lizard,What is the Komodo Dragon?
Animals,1000,This deep-sea fish has a bioluminescent lure on its head,What is the Anglerfish?
Animals,1000,This amphibian can regenerate lost limbs,What is the Axolotl?
Animals,1000,This insect is known as the world’s deadliest animal due to disease transmission,What is the Mosquito?
Four Letter Words,200,This large feline is called the king of the jungle,What is Lion?
Four Letter Words,200,This frozen form of water falls in winter,What is Snow?
Four Letter Words,200,This bright object lights the sky at night,What is Moon?
Four Letter Words,200,This precious yellow metal is used in jewelry,What is Gold?
Four Letter Words,200,This animal hops and has long ears,What is Hare?
Four Letter Words,400,This amphibian lives near ponds and croaks,What is Frog?
Four Letter Words,400,This is the opposite of lose,What is Gain?
Four Letter Words,400,This is a synonym for rapid,What is Fast?
Four Letter Words,400,This nocturnal canine is known for howling,What is Wolf?
Four Letter Words,400,This marine fish often used in sushi,What is Tuna?
Four Letter Words,600,This is the opposite of good,What is Evil?
Four Letter Words,600,This is a synonym for clever,What is Wise?
Four Letter Words,600,This farm animal gives milk,What is Goat?
Four Letter Words,600,This falls from the sky during a storm,What is Rain?
Four Letter Words,600,This is a synonym for roadway,What is Lane?
Four Letter Words,800,This is the opposite of soft,What is Hard?
Four Letter Words,800,This color is between blue and green,What is Teal?
Four Letter Words,800,This stinging insect lives in colonies,What is Wasp?
Four Letter Words,800,This climbing plant often covers walls,What is Vine?
Four Letter Words,800,This is a synonym for stone,What is Rock?
Four Letter Words,1000,This body part helps you grip,What is Palm?
Four Letter Words,1000,This plural of ox refers to draft cattle,What is Oxen?
Four Letter Words,1000,This small field rodent rhymes with mole,What is Vole?
Four Letter Words,1000,This alcoholic drink is made from honey,What is Mead?
Four Letter Words,1000,This seabird with long wings rhymes with fern,What is Tern?
Double Letter Words,200,This insect makes honey and can sting,What is Bee?
Double Letter Words,200,This farm animal gives wool and says baa,What is Sheep?
Double Letter Words,200,This color between blue and yellow has double e,What is Green?
Double Letter Words,200,This hot drink is made from roasted beans,What is Coffee?
Double Letter Words,200,This baby cat is often called a kitty,What is Kitten?
Double Letter Words,400,This dairy spread goes on toast,What is Butter?
Double Letter Words,400,This young canine,What is Puppy?
Double Letter Words,400,This court sport uses rackets,What is Tennis?
Double Letter Words,400,This piece of mail arrives in an envelope,What is Letter?
Double Letter Words,400,This masked nocturnal mammal often raids trash cans,What is Raccoon?
Double Letter Words,600,This glass surface reflects your image,What is Mirror?
Double Letter Words,600,This small mammal gathers nuts with its bushy tail,What is Squirrel?
Double Letter Words,600,This cutting tool has two blades,What is Scissors?
Double Letter Words,600,This verb means to achieve or prosper,What is Succeed?
Double Letter Words,600,This inflatable party decoration,What is Balloon?
Double Letter Words,800,This location information includes street and city,What is Address?
Double Letter Words,800,This orange root vegetable used in soups and stews,What is Carrot?
Double Letter Words,800,This oily fish is often canned or smoked,What is Herring?
Double Letter Words,800,This female ballet dancer,What is Ballerina?
Double Letter Words,800,This Italian coffee drink made with espresso and milk foam,What is Cappuccino?
Double Letter Words,1000,This group that makes decisions for an organization,What is Committee?
Double Letter Words,1000,This US state name is famous for river and double letters,What is Mississippi?
Double Letter Words,1000,This Italian cheese often used on pizza,What is Mozzarella?
Double Letter Words,1000,This word means great energy or flair in style,What is Pizzazz?
Double Letter Words,1000,This process of maintaining financial records,What is Bookkeeping?
Minecraft,200,This green hostile mob explodes near players,What is a Creeper?
Minecraft,200,This item restores health when eaten,What is Bread?
Minecraft,200,This block is needed to craft torches,What is Coal?
Minecraft,200,This animal drops wool when sheared,What is a Sheep?
Minecraft,200,This biome is filled with sand and cacti,What is the Desert?
Minecraft,400,This boss lives in the dimension called The End,What is the Ender Dragon?
Minecraft,400,This ore is used to craft stronger armor than iron,What is Diamond?
Minecraft,400,This hostile mob shoots arrows from a distance,What is a Skeleton?
Minecraft,400,This tool is needed to mine obsidian,What is a Diamond Pickaxe?
Minecraft,400,This potion makes you invisible to mobs,What is Potion of Invisibility?
Minecraft,600,This dimension has ghasts and nether fortresses,What is the Nether?
Minecraft,600,This enchantment increases walking speed on soul sand,What is Soul Speed?
Minecraft,600,This red ore powers machines and contraptions,What is Redstone?
Minecraft,600,This mob drops blaze rods,What is a Blaze?
Minecraft,600,This block can be used to enchant gear with lapis,What is an Enchanting Table?
Minecraft,800,This hostile mob spawns only underwater and attacks with a trident,What is a Drowned?
Minecraft,800,This rare biome has blue-green grass and mooshrooms,What is the Mushroom Island?
Minecraft,800,This structure in the ocean contains guardians and sponges,What is an Ocean Monument?
Minecraft,800,This villager profession trades enchanted books,What is a Librarian?
Minecraft,800,This item allows you to respawn in the Nether,What is a Respawn Anchor?
Minecraft,1000,This rare drop from a phantom can repair elytra,What is a Phantom Membrane?
Minecraft,1000,This mob summons vexes and uses magic attacks,What is an Evoker?
Minecraft,1000,This hidden dimension was rumored but never added,What is the Far Lands?
Minecraft,1000,This effect allows a player to breathe underwater indefinitely,What is Conduit Power?
Minecraft,1000,This biome generates tall spruce trees and podzol,What is the Mega Taiga?
Fortnite,200,This bus carries players into the match,What is the Battle Bus?
Fortnite,200,This shrinking circle damages players outside of it,What is the Storm?
Fortnite,200,This is the name of the in game currency,What are V Bucks?
Fortnite,200,This building material is the weakest of the three,What is Wood?
Fortnite,200,This island is the main play area for each match,What is the Battle Royale Island?
Fortnite,200,This named location was a tropical resort style area in Chapter 1,What is Lazy Lagoon?
Fortnite,200,This desert area contained a racetrack in Chapter 1 Season 5,What is Paradise Palms?
Fortnite,200,This snowy area featured a castle and ice structures,What is Polar Peak?
Fortnite,400,This material builds the strongest structures,What is Metal?
Fortnite,400,This area contains NPC bosses and vaults each season,What are Points of Interest?
Fortnite,400,This feature lets players collect loot after being eliminated,What is the Reboot Card?
Fortnite,400,This word describes the colorful rarity of items,What is Rarity?
Fortnite,400,This mode pairs two players together,What is Duos?
Fortnite,400,This location had a huge crater after a meteor strike,What is Dusty Divot?
Fortnite,400,This area had tall towers and many chests in the city setting,What is Tilted Towers?
Fortnite,400,This swampy location featured Slurp barrels and trees,What is Slurpy Swamp?
Fortnite,600,This vehicle lets players redeploy and escape the storm,What is a Launch Pad?
Fortnite,600,This type of drop from the sky contains high quality loot,What is a Supply Drop?
Fortnite,600,This weapon fires explosives and rockets,What is a Rocket Launcher?
Fortnite,600,This tool is used to gather building materials,What is the Harvesting Tool or Pickaxe?
Fortnite,600,This feature lets players hide inside shrubs or dumpsters,What is Hiding Spots?
Fortnite,600,This mountain location had ziplines and a villain lair,What is The Volcano?
Fortnite,600,This underground bunker area was a famous hiding spot,What is The Agency Vault?
Fortnite,600,This tropical biome replaced part of the island in Season 8,What is Sunny Steps?
Fortnite,800,This feature allows players to complete missions for XP,What are Quests?
Fortnite,800,This type of victory is the last team or player standing,What is a Victory Royale?
Fortnite,800,This character agent ran the Imagined Order storyline,Who is Agent Jonesy?
Fortnite,800,This event ends a season with a massive in game spectacle,What is a Live Event?
Fortnite,800,This mechanic introduced sliding downhill,What is Sliding?
Fortnite,800,This futuristic city replaced Tilted Towers in Season 9,What is Neo Tilted?
Fortnite,800,This giant robot fought the monster at this location,What is Pressure Plant?
Fortnite,800,This island landmark had a giant chair made of wood,What is the Giant Wooden Chair?
Fortnite,1000,This Marvel villain appeared in a huge crossover event,Who is Thanos?
Fortnite,1000,This place was destroyed by a meteor in Season 4,What is Dusty Depot?
Fortnite,1000,This rare weapon fires explosive projectiles in bursts,What is the Quad Launcher?
Fortnite,1000,This feature allows two players to share loot between each other,What is Item Dropping?
Fortnite,1000,This creative mode lets players build their own maps,What is Fortnite Creative?
Fortnite,1000,This underwater area became accessible after the flood,What is Coral Castle?
Fortnite,1000,This secretive base belonged to Midas and the Agency,What is The Authority?
Fortnite,1000,This floating island often moved around the map powered by the Cube,What is Kevins Floating Island?
Pokemon,200,This yellow Electric type is the mascot of the franchise,Who is Pikachu?
Pokemon,200,This small green grass type starter was first seen in Kanto,Who is Bulbasaur?
Pokemon,200,This ball is used to catch wild Pokemon,What is a Pokeball?
Pokemon,200,This fire type starter evolves into Charizard,Who is Charmander?
Pokemon,200,This blue water type starter evolves into Blastoise,Who is Squirtle?
Pokemon,200,This type is super effective against Fire types,What is Water?
Pokemon,200,This type resists Electric type moves,What is Ground?
Pokemon,200,This Pokemon is known as the Mouse Pokemon,Who is Pikachu?
Pokemon,200,This Pokemon is known as the Seed Pokemon,Who is Bulbasaur?
Pokemon,400,This region is home to Pallet Town and Pewter City,What is Kanto?
Pokemon,400,This legendary bird represents thunder,Who is Zapdos?
Pokemon,400,This move recovers half the users max HP,What is Recover?
Pokemon,400,This item heals all status conditions of a Pokemon,What is a Full Heal?
Pokemon,400,This type is super effective against Water types,What is Electric or Grass?
Pokemon,400,This type is immune to Normal type moves,What is Ghost?
Pokemon,400,This type is weak to Steel and Poison types,What is Fairy?
Pokemon,400,This Pokemon is known as the Tiny Turtle Pokemon,Who is Squirtle?
Pokemon,400,This Pokemon is known as the Flame Pokemon,Who is Charmander?
Pokemon,600,This city in Kanto contains the Pokemon Tower,What is Lavender Town?
Pokemon,600,This fossil Pokemon can revive into Kabutops,What is Kabuto?
Pokemon,600,This dragon type legendary Pokemon represents time,Who is Dialga?
Pokemon,600,This ability doubles speed in rain,What is Swift Swim?
Pokemon,600,This item boosts a Pokemons friendship when held,What is a Soothe Bell?
Pokemon,600,This type resists Bug Steel Grass and Ice moves,What is Fire?
Pokemon,600,This type is weak to Fighting but strong against Psychic,What is Dark?
Pokemon,600,This Pokemon is known as the Legendary Bird of Ice,Who is Articuno?
Pokemon,600,This Pokemon is known as the Legendary Bird of Fire,Who is Moltres?
Pokemon,800,This move allows a Pokemon to switch out after dealing damage,What is U Turn?
Pokemon,800,This region introduced Dynamax battles,What is Galar?
Pokemon,800,This Pokemon is known as the Genetic Pokemon,Who is Mewtwo?
Pokemon,800,This type is immune to Psychic moves,What is Dark?
Pokemon,800,This Pokemon evolves into Gardevoir or Gallade,What is Ralts?
Pokemon,800,This type is immune to Electric attacks,What is Ground?
Pokemon,800,This Pokemon is known as the Aura Pokemon,Who is Lucario?
Pokemon,1000,This move lets a Pokemon temporarily transform into a special form,What is Mega Evolution?
Pokemon,1000,This island region introduced Z Moves,What is Alola?
Pokemon,1000,This legendary Pokemon created the Pokemon universe,Who is Arceus?
Pokemon,1000,This rare item evolves Feebas into Milotic,What is a Prism Scale?
Pokemon,1000,This region contains the Battle Frontier and Mt Chimney,What is Hoenn?
Pokemon,1000,This Pokemon is known as the Original One who created all Pokemon,Who is Arceus?
Brands,200,This brand uses a swoosh logo,What is Nike?
Brands,200,This brand created the iPhone,What is Apple?
Brands,200,This soft drink is known for its red can,What is Coca Cola?
Brands,200,This brand makes the Big Mac burger,What is McDonalds?
Brands,200,This brand has a golden arches logo,What is McDonalds?
Brands,200,This fast food chain is known for the Whopper,What is Burger King?
Brands,200,This brand is famous for its three stripe logo on shoes,What is Adidas?
Brands,200,This company makes Frosted Flakes cereal,What is Kelloggs?
Brands,200,This brand slogan is Just Do It,What is Nike?
Brands,200,This brand is known for a red and white logo and fried chicken,What is KFC?
Brands,400,This brand makes the PlayStation console,What is Sony?
Brands,400,This tech company owns the Android operating system,What is Google?
Brands,400,This fast food chain sells the Frosty dessert,What is Wendys?
Brands,400,This brand is known for its polar bear commercials at Christmas,What is Coca Cola?
Brands,400,This sneaker brand is endorsed by Michael Jordan,What is Air Jordan?
Brands,400,This online streaming service features a red N logo,What is Netflix?
Brands,400,This chocolate bar slogan is Have a Break Have a,What is KitKat?
Brands,400,This toy brand makes plastic bricks for building,What is Lego?
Brands,400,This company makes the Galaxy line of phones,What is Samsung?
Brands,400,This brand produces iPads and Macs,What is Apple?
Brands,600,This video game company makes Mario and Zelda,What is Nintendo?
Brands,600,This soda was originally called Brad’s Drink,What is Pepsi?
Brands,600,This American car brand makes the Mustang,What is Ford?
Brands,600,This brand sells online auctions and shopping,What is eBay?
Brands,600,This sports brand makes basketballs and golf balls with a swoosh,What is Nike?
Brands,600,This brand has a blue bird logo,What is Twitter or X?
Brands,600,This frozen treat brand uses a spoon bending Blizzard,What is Dairy Queen?
Brands,600,This brand makes Doritos and Lays chips,What is Frito Lay?
Brands,600,This company makes Alexa smart speakers,What is Amazon?
Brands,600,This brand created Windows operating system,What is Microsoft?
Brands,800,This clothing brand is known for its crocodile logo,What is Lacoste?
Brands,800,This brand produces Beats headphones,What is Apple?
Brands,800,This fast food chain uses a bell in its logo,What is Taco Bell?
Brands,800,This athletic brand sponsors the Olympics and uses a check logo,What is Nike?
Brands,800,This brand has the slogan Think Different,What is Apple?
Brands,800,This soda brand features a blue can and slogan Obey Your Thirst,What is Sprite?
Brands,800,This luxury brand uses interlocking C logo,What is Chanel?
Brands,800,This company makes electric vehicles and rockets,What is Tesla?
Brands,800,This candy brand uses colorful button shaped chocolate,What are M&Ms?
Brands,800,This streaming service features a green circle logo,What is Spotify?
Brands,1000,This company originally sold books online before becoming huge retailer,What is Amazon?
Brands,1000,This car brand makes the luxury division called Lexus,What is Toyota?
Brands,1000,This company owns Instagram and WhatsApp,What is Meta or Facebook?
Brands,1000,This luxury fashion house is known for its LV monogram,What is Louis Vuitton?
Brands,1000,This search engine brand slogan is Dont be Evil,What is Google?
Brands,1000,This computer chip maker has the slogan Intel Inside,What is Intel?
Brands,1000,This brand makes the Cybertruck,What is Tesla?
Brands,1000,This sports drink brand uses lightning bolt logo,What is Gatorade?
Brands,1000,This Swedish furniture brand sells flat pack furniture,What is IKEA?
Brands,1000,This automotive brand is known for the prancing horse logo,What is Ferrari?
Celebrity,200,This singer is known for the song Shake It Off,Who is Taylor Swift?
Celebrity,200,This actor played Iron Man in Marvel movies,Who is Robert Downey Jr?
Celebrity,200,This actress starred in the movie Mean Girls,Who is Lindsay Lohan?
Celebrity,200,This actor played Jack Sparrow in Pirates of the Caribbean,Who is Johnny Depp?
Celebrity,200,This basketball player is known as King James,Who is LeBron James?
Celebrity,400,This actress portrayed Katniss Everdeen in Hunger Games,Who is Jennifer Lawrence?
Celebrity,400,This actor played Deadpool in Marvel movies,Who is Ryan Reynolds?
Celebrity,400,This actor played Wolverine in the X Men films,Who is Hugh Jackman?
Celebrity,400,This singer performed the hit song Umbrella,Who is Rihanna?
Celebrity,400,This actor starred in the Mission Impossible film series,Who is Tom Cruise?
Celebrity,600,This pop star is known for the song Bad Romance,Who is Lady Gaga?
Celebrity,600,This actress played Hermione in the Harry Potter series,Who is Emma Watson?
Celebrity,600,This actor portrayed Spider Man in the MCU starting in 2016,Who is Tom Holland?
Celebrity,600,This actor starred in the movie Titanic as Jack,Who is Leonardo DiCaprio?
Celebrity,600,This singer performed Thriller and Billie Jean,Who is Michael Jackson?
Celebrity,800,This actress starred in the TV show Friends as Rachel,Who is Jennifer Aniston?
Celebrity,800,This actor portrayed Tony Stark’s father Howard Stark in MCU,Who is Dominic Cooper?
Celebrity,800,This rapper released the album The Chronic,Who is Dr Dre?
Celebrity,800,This comedian is known for the Netflix special Sticks and Stones,Who is Dave Chappelle?
Celebrity,800,This actress starred in the Twilight movies as Bella Swan,Who is Kristen Stewart?
Celebrity,1000,This actor played Neo in The Matrix trilogy,Who is Keanu Reeves?
Celebrity,1000,This singer is known as the Queen of Pop,Who is Madonna?
Celebrity,1000,This actor portrayed Joker in The Dark Knight,Who is Heath Ledger?
Celebrity,1000,This director created the Avatar and Titanic films,Who is James Cameron?
Celebrity,1000,This rapper’s real name is Shawn Carter,Who is Jay Z?
Famous landmarks,200,This tower in Paris is a symbol of France,What is the Eiffel Tower?
Famous landmarks,200,This American statue was a gift from France,What is the Statue of Liberty?
Famous landmarks,200,This ancient arena is located in Rome,What is the Colosseum?
Famous landmarks,200,This bell tower is in London next to the Houses of Parliament,What is Big Ben?
Famous landmarks,200,This famous clock can be found in Prague,What is the Astronomical Clock?
Famous landmarks,400,This famous barrier stretches thousands of miles in China,What is the Great Wall of China?
Famous landmarks,400,This large tower is in Seattle Washington,What is the Space Needle?
Famous landmarks,400,This mausoleum is a Wonder of the World in India,What is the Taj Mahal?
Famous landmarks,400,This arch is located in St Louis Missouri,What is the Gateway Arch?
Famous landmarks,400,This famous opera house is located in Australia,What is the Sydney Opera House?
Famous landmarks,600,This mountain is the tallest in the world,What is Mount Everest?
Famous landmarks,600,This sacred mountain is in Japan and is a symbol of the country,What is Mount Fuji?
Famous landmarks,600,This landmark in South Dakota features four presidents,What is Mount Rushmore?
Famous landmarks,600,This famous mosque is located in Istanbul Turkey,What is the Hagia Sophia?
Famous landmarks,600,This city has the Christ the Redeemer statue on a mountain,What is Rio de Janeiro?
Famous landmarks,800,This desert structure in Egypt is one of the Seven Wonders of the Ancient World,What are the Pyramids of Giza?
Famous landmarks,800,This ancient Inca city is high in the Andes mountains,What is Machu Picchu?
Famous landmarks,800,This landmark is a medieval fortress in London,What is the Tower of London?
Famous landmarks,800,This bridge connects San Francisco to Marin County,What is the Golden Gate Bridge?
Famous landmarks,800,This landmark is a large ancient amphitheater in Greece,What is the Theatre of Epidaurus?
Famous landmarks,1000,This island is home to a prison near San Francisco Bay,What is Alcatraz?
Famous landmarks,1000,This prehistoric monument of standing stones is in England,What is Stonehenge?
Famous landmarks,1000,This landmark is a massive canyon carved by the Colorado River,What is the Grand Canyon?
Famous landmarks,1000,This massive rock in Australia is sacred to Aboriginal people,What is Uluru?
Famous landmarks,1000,This palace in France was once home to French royalty,What is the Palace of Versailles?
Marvel vs dc,200,This Marvel hero wields a shield with a star,Who is Captain America?
Marvel vs dc,200,This DC hero is known as the Dark Knight,Who is Batman?
Marvel vs dc,200,This Marvel hero wears an iron suit and is a genius inventor,Who is Iron Man?
Marvel vs dc,200,This DC hero uses a lasso of truth,Who is Wonder Woman?
Marvel vs dc,200,This Marvel hero can shoot webs and climb walls,Who is Spider Man?
Marvel vs dc,400,This DC hero is from the planet Krypton,Who is Superman?
Marvel vs dc,400,This Marvel team includes Mr Fantastic Invisible Woman Human Torch and Thing,Who are the Fantastic Four?
Marvel vs dc,400,This DC villain is known for his love of riddles,Who is the Riddler?
Marvel vs dc,400,This Marvel villain seeks the Infinity Stones,Who is Thanos?
Marvel vs dc,400,This DC hero runs at superhuman speed,Who is the Flash?
Marvel vs dc,600,This Marvel villain is the brother of Thor,Who is Loki?
Marvel vs dc,600,This DC antihero uses fear toxin,Who is Scarecrow?
Marvel vs dc,600,This Marvel hero has claws and healing powers,Who is Wolverine?
Marvel vs dc,600,This DC hero fights crime in Star City with a bow,Who is Green Arrow?
Marvel vs dc,600,This Marvel hero controls metal with his mind,Who is Magneto?
Marvel vs dc,800,This DC villain is known as the Clown Prince of Crime,Who is the Joker?
Marvel vs dc,800,This Marvel group includes Rocket Groot and Star Lord,Who are the Guardians of the Galaxy?
Marvel vs dc,800,This DC hero has a power ring from the Green Lantern Corps,Who is Green Lantern?
Marvel vs dc,800,This Marvel hero turns big and green when angry,Who is the Hulk?
Marvel vs dc,800,This DC villain is an eco terrorist connected to plants,Who is Poison Ivy?
Marvel vs dc,1000,This Marvel villain devours entire planets,Who is Galactus?
Marvel vs dc,1000,This DC villain is the intergalactic conqueror who wields Omega Beams,Who is Darkseid?
Marvel vs dc,1000,This Marvel hero is the Sorcerer Supreme,Who is Doctor Strange?
Marvel vs dc,1000,This DC hero is an Amazonian warrior and queen,Who is Hippolyta?
Marvel vs dc,1000,This Marvel villain is a symbiote rival to Spider Man,Who is Venom?
Video game characters,200,This Italian plumber is Nintendo’s mascot,Who is Mario?
Video game characters,200,This blue hedgehog is known for speed,Who is Sonic?
Video game characters,200,This character collects rings and battles Dr Eggman,Who is Sonic?
Video game characters,200,This princess is often rescued in the Mushroom Kingdom,Who is Princess Peach?
Video game characters,200,This yellow circular character eats pellets in mazes,Who is Pac Man?
Video game characters,200,This green dinosaur is Marios companion in many games,Who is Yoshi?
Video game characters,200,This pink character rolls around collecting fruit in PAC MAN games,Who is Ms Pac Man?
Video game characters,200,This orange bandicoot stars in a PlayStation platforming series,Who is Crash Bandicoot?
Video game characters,200,This cute creature from Pokemon evolves into Raichu,Who is Pichu?
Video game characters,200,This round enemy in Mario games has spikes and bounces,What is a Spiny?
Video game characters,400,This character wields the Master Sword in The Legend of Zelda,Who is Link?
Video game characters,400,This bounty hunter wears an orange power suit in Metroid,Who is Samus Aran?
Video game characters,400,This purple dragon breathes fire in a classic PlayStation series,Who is Spyro?
Video game characters,400,This character is the main rival of Mario in racing and party games,Who is Luigi?
Video game characters,400,This fox leads a team of space pilots in Star Fox,Who is Fox McCloud?
Video game characters,400,This swordsman is known as the Hero of Time,Who is Link?
Video game characters,400,This rival plumber wears green and is Marios brother,Who is Luigi?
Video game characters,400,This crocodile king is the main villain of Donkey Kong Country,Who is King K Rool?
Video game characters,400,This villain steals stars in Mario Party games,Who is Bowser Jr?
Video game characters,400,This powerful psychic Pokemon appears in Super Smash Bros,Who is Mewtwo?
