Category,Value,Question,Answer
Video game characters,600,This soldier fights aliens in the Halo series,Who is Master Chief?
Video game characters,600,This monster hunter from The Witcher uses two swords,Who is Geralt of Rivia?
Video game characters,600,This character fights dragons in Skyrim as the Dragonborn,Who is the Dovahkiin?
Video game characters,600,This electric type Pokemon is the franchise mascot,Who is Pikachu?
Video game characters,600,This hero in Overwatch uses a pulse bomb and can rewind time,Who is Tracer?
Video game characters,600,This dark counterpart of Link appears in Zelda games,Who is Dark Link?
Video game characters,600,This main character of Halo Reach sacrifices himself,Who is Noble Six?
Video game characters,600,This Spartan warrior fights gods in a PlayStation series,Who is Kratos?
Video game characters,600,This villager representative fights with bug nets in Smash Bros,Who is Villager?
Video game characters,600,This masked hunter from Bloodborne wields trick weapons,Who is The Hunter?
Video game characters,800,This masked fighter in Mortal Kombat uses ice powers,Who is Sub Zero?
Video game characters,800,This plumber’s nemesis is a spiky shelled turtle,Who is Bowser?
Video game characters,800,This stealthy assassin is the main protagonist of the first Assassin’s Creed,Who is Altair?
Video game characters,800,This pink puffball can inhale enemies and copy abilities,Who is Kirby?
Video game characters,800,This fighter pilots an armored suit and has an AI companion called Cortana,Who is Master Chief?
Video game characters,800,This stealth hero in Tenchu uses ninjutsu and grappling hooks,Who is Rikimaru?
Video game characters,800,This villain of Resident Evil 2 stalks the player relentlessly,Who is Mr X?
Video game characters,800,This champion from League of Legends uses spinning axes,Who is Draven?
Video game characters,800,This character is the main hero of Half Life,Who is Gordon Freeman?
Video game characters,800,This time traveling hero wears green tunic in Zelda Ocarina of Time,Who is Link as Young Link?
Video game characters,1000,This character is the main villain of the Final Fantasy VII series,Who is Sephiroth?
Video game characters,1000,This female character explores tombs and ancient ruins,Who is Lara Croft?
Video game characters,1000,This swordsman from Fire Emblem appears in Super Smash Bros,Who is Marth?
Video game characters,1000,This robot hero of Capcom fights Dr Wily’s creations,Who is Mega Man?
Video game characters,1000,This character from Metal Gear Solid sneaks in boxes and uses stealth tactics,Who is Solid Snake?
Video game characters,1000,This scientist becomes a villain in Sonic series,Who is Dr Eggman?
Video game characters,1000,This main villain of Borderlands 2 is charismatic and cruel,Who is Handsome Jack?
Video game characters,1000,This character from Dark Souls is known as the Chosen Undead,Who is The Chosen Undead?
Video game characters,1000,This vampire hunter wields the whip Vampire Killer,Who is Simon Belmont?
Video game characters,1000,This cybernetic ninja from Overwatch wields a katana,Who is Genji?
NFL trivia,200,This team’s colors are silver and black based in Las Vegas,Who are the Raiders?
NFL trivia,200,This city is home to the Packers,What is Green Bay?
NFL trivia,200,This position usually throws the football,What is Quarterback?
NFL trivia,200,This trophy is awarded to the Super Bowl champion,What is the Vince Lombardi Trophy?
NFL trivia,200,This team is known as America’s Team,Who are the Dallas Cowboys?
NFL trivia,200,This city hosts the team called the Chiefs,What is Kansas City?
NFL trivia,200,This player is nicknamed TB12,Who is Tom Brady?
NFL trivia,200,This team has won the most Super Bowls tied with the Patriots,Who are the Pittsburgh Steelers?
NFL trivia,200,This championship game decides who goes to the Super Bowl from the AFC,What is the AFC Championship?
NFL trivia,200,This team’s fans perform the Skol chant,Who are the Minnesota Vikings?
NFL trivia,400,This defensive player is known for his sack dance and played for the Giants,Who is Michael Strahan?
NFL trivia,400,This player known as Beast Mode ran for a famous playoff touchdown,Who is Marshawn Lynch?
NFL trivia,400,This QB led the 1972 Dolphins to a perfect season,Who is Bob Griese?
NFL trivia,400,This team won the first two Super Bowls,Who are the Green Bay Packers?
NFL trivia,400,This QB was the first pick of the 2020 NFL Draft,Who is Joe Burrow?
NFL trivia,400,This QB was drafted by the Chargers but traded to the Giants in 2004,Who is Eli Manning?
NFL trivia,400,This team’s mascot is a large bird named Swoop,Who are the Philadelphia Eagles?
NFL trivia,400,This city is home to the Seahawks,What is Seattle?
NFL trivia,400,This city is home to the Ravens,What is Baltimore?
NFL trivia,400,This player caught the Helmet Catch in Super Bowl XLII,Who is David Tyree?
NFL trivia,600,This wide receiver is nicknamed Megatron,Who is Calvin Johnson?
NFL trivia,600,This player known as Prime Time played both football and baseball,Who is Deion Sanders?
NFL trivia,600,This QB threw 55 touchdowns in the 2013 season,Who is Peyton Manning?
NFL trivia,600,This team moved from St Louis to Los Angeles in 2016,Who are the Rams?
NFL trivia,600,This defensive position lines up to tackle the quarterback or stop the run,What is Defensive End?
NFL trivia,600,This team’s nickname is the Monsters of the Midway,Who are the Chicago Bears?
NFL trivia,600,This kicker holds the record for the longest field goal at 66 yards,Who is Justin Tucker?
NFL trivia,600,This city hosted the 2020 NFL Draft virtually,What is Las Vegas?
NFL trivia,600,This stadium hosts the Dallas Cowboys home games,What is AT&T Stadium?
NFL trivia,600,This QB was known as The Sheriff and played for the Colts and Broncos,Who is Peyton Manning?
NFL trivia,800,This defensive lineman is known as the Minister of Defense,Who is Reggie White?
NFL trivia,800,This QB was the first to throw for 5000 yards in a season,Who is Dan Marino?
NFL trivia,800,This player known as Sweetness rushed for 16726 yards in his career,Who is Walter Payton?
NFL trivia,800,This team won the Super Bowl after the 2009 season with Drew Brees,Who are the New Orleans Saints?
NFL trivia,800,This quarterback led the Chiefs to a Super Bowl win in 2020,Who is Patrick Mahomes?
NFL trivia,800,This NFL division includes the Cowboys Eagles Giants and Commanders,What is the NFC East?
NFL trivia,800,This QB was known as Broadway Joe and guaranteed a Super Bowl win,Who is Joe Namath?
NFL trivia,800,This team went to four straight Super Bowls and lost all of them,Who are the Buffalo Bills?
NFL trivia,800,This NFL owner famously built the Dallas Cowboys into a powerhouse,Who is Jerry Jones?
NFL trivia,800,This city hosted the Ice Bowl in 1967,What is Green Bay?
NFL trivia,1000,This running back holds the record for most career rushing yards,Who is Emmitt Smith?
NFL trivia,1000,This running back rushed for over 2000 yards in 1997 for the Lions,Who is Barry Sanders?
NFL trivia,1000,This defensive back has the most career interceptions with 81,Who is Paul Krause?
NFL trivia,1000,This QB is the only one to win Super Bowls with two different teams as starter,Who is Peyton Manning?
NFL trivia,1000,This QB was the first to throw for 5000 yards in a season,Who is Dan Marino?
NFL trivia,1000,This NFL event happens in April where college players are selected,What is the NFL Draft?
NFL trivia,1000,This QB led the 1972 Dolphins to a perfect season,Who is Bob Griese?
NFL trivia,1000,This team drafted Tom Brady in the sixth round,Who are the New England Patriots?
NFL trivia,1000,This QB was known as The Sheriff and played for the Colts and Broncos,Who is Peyton Manning?
NFL trivia,1000,This QB was the first pick of the 2020 NFL Draft,Who is Joe Burrow?
GTA V,200,This fictional city in GTA V is based on Los Angeles,What is Los Santos?
GTA V,200,This retired bank robber is one of the three protagonists,Who is Michael De Santa?
GTA V,200,This street hustler dreams of making it big in Los Santos,Who is Franklin Clinton?
GTA V,200,This unpredictable Canadian criminal is one of the three protagonists,Who is Trevor Philips?
GTA V,200,This in game feature shows how wanted you are by police,What is the Wanted Level?
GTA V,200,This dog belongs to Franklin in GTA V,Who is Chop?
GTA V,200,This car customization shop lets you respray and upgrade vehicles,What is Los Santos Customs?
GTA V,200,This activity can be played at Los Santos Golf Club,What is Golf?
GTA V,200,This smartphone feature allows characters to take selfies,What is the Snapmatic App?
GTA V,200,This social network in GTA V parodies Facebook,What is Lifeinvader?
GTA V,400,This government agency parodies the FBI,What is the FIB?
GTA V,400,This island added in an Online update hosts a big heist,What is Cayo Perico?
GTA V,400,This military base contains tanks jets and a huge hangar,What is Fort Zancudo?
GTA V,400,This liquor store can be robbed repeatedly for cash,What is a Convenience Store?
GTA V,400,This celebrity missions photographer constantly harasses stars,What is Paparazzo?
GTA V,400,This item lets players store vehicles safely,What is a Garage?
GTA V,400,This armored truck can be hijacked for cash pickups,What is an Armored Van?
GTA V,400,This aircraft can carry a car or small vehicle underneath,What is the Cargobob?
GTA V,400,This area in Blaine County features a satellite array and UFO rumors,What is the Grand Senora Desert?
GTA V,400,This Los Santos neighborhood is Franklin’s original home,What is Strawberry?
GTA V,600,This Online heist involves robbing a casino,What is the Diamond Casino Heist?
GTA V,600,This early mission teaches you to repossess cars for Simeon,What is Franklin and Lamar?
GTA V,600,This group of antagonists wear green and are Franklin’s old gang,Who are the Families?
GTA V,600,This antagonist tortures a man during an infamous mission,Who is Trevor Philips?
GTA V,600,This plane hijacking mission ends with you taking over a military cargo plane,What is Minor Turbulence?
GTA V,600,This Online business lets you buy and sell illegal narcotics,What is a Motorcycle Club?
GTA V,600,This feature in GTA V lets you invest money and manipulate the stock market,What is the BAWSAQ or LCN?
GTA V,600,This main road runs along the west coast of Los Santos County,What is Great Ocean Highway?
GTA V,600,This rare animal appears on Mount Chiliad and can be hunted,What is the Mountain Lion?
GTA V,600,This NPC gives assassination missions to Franklin,Who is Lester Crest?
GTA V,800,This GTA V main heist has you robbing a jewelry store,What is The Jewel Store Job?
GTA V,800,This strip club is frequently featured in the story and Online,What is Vanilla Unicorn?
GTA V,800,This villain runs the Merryweather private security company,What is Merryweather Security?
GTA V,800,This Online update allowed you to run nightclubs,What is After Hours?
GTA V,800,This property north of Los Santos can be bought and includes a hangar,What is McKenzie Airfield?
GTA V,800,This aircraft is a personal jet with luxury interior,What is the Luxor Deluxe?
GTA V,800,This GTA V mural on Mount Chiliad spawned countless conspiracy theories,What is the Mount Chiliad Mystery?
GTA V,800,This supercar is based on the Bugatti Veyron in GTA V,What is the Adder?
GTA V,800,This area in Paleto Bay is home to a key heist,What is the Paleto Bay Bank?
GTA V,800,This radio station hosted by DJ George features funk and soul classics,What is Space 103.2?
GTA V,1000,This GTA V achievement is earned by completing the game without dying,What is Unmarked?
GTA V,1000,This secret ghost can be seen on Mount Gordo at night,What is Jolene Cranley Evans?
GTA V,1000,This UFO appears over Fort Zancudo after 100 percent completion,What is the Alien UFO?
GTA V,1000,This Easter egg lets players find a frozen alien under a bridge,What is the Frozen Alien?
GTA V,1000,This Online submarine headquarters lets you launch missions,What is the Kosatka Submarine?
GTA V,1000,This hidden interior can be accessed in single player via glitch at a city landmark,What is the FIB Building Interior?
GTA V,1000,This special drug trip mission turns Trevor into a clumsy clapping clown killer,What is The Grass Roots Missions?
GTA V,1000,This vehicle in Online can fly and has missiles making it notorious,What is the Oppressor Mk II?
GTA V,1000,This rare peyote plant turns players into Bigfoot,What is the Bigfoot
Fantasy football,200,This is the most common format of fantasy football scoring,What is PPR or Standard Scoring?
Fantasy football,200,This NFL position typically scores the most points per game,What is Quarterback?
Fantasy football,200,This type of player catches passes from quarterbacks,What is Wide Receiver?
Fantasy football,200,This type of player runs the ball and can also catch passes,What is Running Back?
Fantasy football,200,This draft position gives you the first pick of the round,What is the 1.01 or First Overall Pick?
Fantasy football,200,This is the most common number of teams in a fantasy league,What is 10 or 12?
Fantasy football,200,This weekly process allows you to add free agents to your roster,What is Waiver Wire?
Fantasy football,200,This is the term for the end of the fantasy season playoffs,What is the Fantasy Championship?
Fantasy football,200,This roster slot is where you place players not starting that week,What is the Bench?
Fantasy football,200,This NFL week is usually avoided by commissioners for championships due to resting starters,What is Week 18?
Fantasy football,400,This strategy waits until later rounds to pick a QB,What is Late Round Quarterback Strategy?
Fantasy football,400,This is the term for a player who scores far more than their average in one week,What is a Boom Week?
Fantasy football,400,This is the term for a player who scores far less than their average in one week,What is a Bust Week?
Fantasy football,400,This type of draft uses real money bids instead of snake picks,What is an Auction Draft?
Fantasy football,400,This roster spot is used for injured players who may return later,What is the IR Spot?
Fantasy football,400,This scoring setting gives points for 100 yard rushing or receiving games,What is Yardage Bonus?
Fantasy football,400,This term describes using two running backs from the same team,What is a Handcuff or RB Handcuff?
Fantasy football,400,This is the day of the week when most NFL games are played,What is Sunday?
Fantasy football,400,This scoring format gives points for return yards,What is Special Teams or Return Yardage Scoring?
Fantasy football,400,This lineup slot can be filled by a running back wide receiver or tight end,What is the Flex Spot?
Fantasy football,600,This NFL player holds the record for most rushing yards in a single game,Who is Adrian Peterson?
Fantasy football,600,This player was the first rookie RB to score over 300 fantasy points in PPR,Who is Saquon Barkley?
Fantasy football,600,This term describes when a fantasy manager starts a player who is on a bye week,What is a Bye Week Blunder?
Fantasy football,600,This draft strategy focuses on selecting WRs early,What is Zero RB Strategy?
Fantasy football,600,This position is typically the last drafted on fantasy teams,What is Defense or Kicker?
Fantasy football,600,This NFL RB earned the nickname “Run CMC” for his fantasy dominance,Who is Christian McCaffrey?
Fantasy football,600,This type of league has players for multiple years with rookie drafts,What is a Dynasty League?
Fantasy football,600,This term describes trading multiple players for one star,What is a 2 for 1 or Package Deal?
Fantasy football,600,This waiver system gives every team equal chance but rotates priority,What is Rolling Waivers?
Fantasy football,600,This fantasy point total is commonly called the Mendoza Line for QBs,What is 20 Fantasy Points?
Fantasy football,800,This 2019 fantasy MVP QB scored over 400 fantasy points,Who is Lamar Jackson?
Fantasy football,800,This TE led all tight ends in fantasy scoring for several years in Kansas City,Who is Travis Kelce?
Fantasy football,800,This term refers to a player who produces more than expected for their draft slot,What is a Sleeper?
Fantasy football,800,This term refers to a player who produces far less than expected for their draft slot,What is a Bust?
Fantasy football,800,This type of scoring gives 6 points per passing TD instead of 4,What is 6 Point Passing TD League?
Fantasy football,800,This RB for the Titans ran for over 2000 yards in 2020,Who is Derrick Henry?
Fantasy football,800,This QB won back to back MVPs in 2020 and 2021 for Green Bay,Who is Aaron Rodgers?
Fantasy football,800,This type of trade is vetoed when league managers find it unfair,What is a Collusion Trade?
Fantasy football,800,This fantasy playoff format allows highest remaining score to advance each round,What is Guillotine League or Survivor Format?
Fantasy football,800,This waiver system gives teams a budget to bid on players,What is FAAB or Free Agent Auction Budget?
Fantasy football,1000,This WR scored the most fantasy points in a single season with 2007 Patriots,Who is Randy Moss?
Fantasy football,1000,This QB set the single season fantasy record with over 480 points in 2018,Who is Patrick Mahomes?
Fantasy football,1000,This nickname refers to the dangerous practice of starting a player from Thursday night without checking injuries,What is the Thursday Night Trap?
Fantasy football,1000,This term describes replacing an injured starter with their direct backup,What is Next Man Up?
Fantasy football,1000,This advanced stat measures how many points above replacement a player is worth,What is VORP or Value Over Replacement Player?
Fantasy football,1000,This type of league has no trades waivers or lineups everything is automated,What is a Best Ball League?
Fantasy football,1000,This rookie QB was drafted first overall in 2021 and became a fantasy starter,Who is Trevor Lawrence?
Fantasy football,1000,This scoring bonus awards points for long TDs over 40 yards,What is a Big Play Bonus?
Fantasy football,1000,This WR for the Vikings became a fantasy star with gritty celebrations,Who is Justin Jefferson?
Fantasy football,1000,This strategy involves streaming defenses or QBs based on opponent each week,What is Streaming?
Fantasy football,1000,This RB for the Browns broke out in 2020 with over 1600 rushing yards,Who is Nick Chubb?
Cars,200,This American company makes the Mustang,What is Ford?
Cars,200,This German brand uses a three pointed star logo,What is Mercedes Benz?
Cars,200,This Japanese company makes the Corolla and Camry,What is Toyota?
Cars,200,This Italian company makes the Ferrari sports car,What is Ferrari?
Cars,200,This brand makes the F 150 pickup truck,What is Ford?
Cars,200,This company produces the Civic and Accord,What is Honda?
Cars,200,This car feature uses GPS to guide drivers,What is Navigation or GPS?
Cars,200,This pedal on the left is used to stop the car,What is the Brake Pedal?
Cars,200,This fuel type powers most traditional cars,What is Gasoline?
Cars,200,This is the American term for the back storage area of a car,What is the Trunk?
Cars,400,This American company produces the Corvette sports car,What is Chevrolet?
Cars,400,This car company produces the luxury brand Lexus,What is Toyota?
Cars,400,This car part connects the steering wheel to the wheels,What is the Steering Column?
Cars,400,This brand produces the Model S electric car,What is Tesla?
Cars,400,This Japanese automaker makes the WRX and Outback,What is Subaru?
Cars,400,This German car brand makes the 911 sports car,What is Porsche?
Cars,400,This U.S. law requires seatbelts in all new cars after 1968,What is Federal Motor Vehicle Safety Standard?
Cars,400,This component cools the engine and contains coolant,What is the Radiator?
Cars,400,This type of transmission shifts gears automatically,What is Automatic Transmission?
Cars,400,This part stores electrical energy to start the car,What is the Battery?
Cars,600,This Italian sports car company makes the Aventador,What is Lamborghini?
Cars,600,This car system controls emissions and uses a catalytic converter,What is the Exhaust System?
Cars,600,This American company was founded by Henry Ford in 1903,What is Ford Motor Company?
Cars,600,This term describes the distance a car has traveled,What is Mileage?
Cars,600,This Japanese carmaker is famous for its rotary engine RX 7,What is Mazda?
Cars,600,This brand developed the Quattro all wheel drive system,What is Audi?
Cars,600,This large American vehicle combines passenger space with truck chassis,What is an SUV?
Cars,600,This part converts engine power into rotational force for wheels,What is the Transmission?
Cars,600,This French brand makes the Clio and Megane,What is Renault?
Cars,600,This fluid is essential for hydraulic braking systems,What is Brake Fluid?
Cars,800,This safety device inflates in a crash to protect passengers,What is an Airbag?
Cars,800,This brand makes the luxury 7 Series sedan,What is BMW?
Cars,800,This American sports car is nicknamed the Vette,What is the Corvette?
Cars,800,This Japanese hybrid car became famous for fuel economy,What is the Toyota Prius?
Cars,800,This Italian luxury brand uses a trident logo,What is Maserati?
Cars,800,This part of the car measures engine revolutions per minute,What is the Tachometer?
Cars,800,This company makes the Challenger and Charger muscle cars,What is Dodge?
Cars,800,This American automaker makes the Escalade SUV,What is Cadillac?
Cars,800,This small spare wheel is used in emergencies,What is a Donut Spare?
Cars,800,This type of car roof can fold back for open air driving,What is a Convertible?
Cars,1000,This Bugatti model once held the record as fastest production car,What is the Veyron?
Cars,1000,This carmaker created the Skyline GT R,What is Nissan?
Cars,1000,This type of forced induction uses exhaust gases to spin a turbine,What is a Turbocharger?
Cars,1000,This racing series features cars like Formula 1,What is Open Wheel Racing?
Cars,1000,This safety feature prevents wheels from locking during braking,What is ABS or Anti Lock Brakes?
Cars,1000,This Swedish automaker produces the Koenigsegg hypercars,What is Koenigsegg?
Cars,1000,This American car brand introduced the Hellcat engine,What is Dodge?
Cars,1000,This feature measures how quickly a car goes from 0 to 60 mph,What is Acceleration Time?
Cars,1000,This type of drive sends power to all four wheels,What is All Wheel Drive?
Cars,1000,This French luxury brand created the Chiron hypercar,What is Bugatti?
California trivia,200,This is the capital city of California,What is Sacramento?
California trivia,200,This city is known for the Golden Gate Bridge,What is San Francisco?
California trivia,200,This city is home to Disneyland,What is Anaheim?
California trivia,200,This desert covers much of southeastern California,What is the Mojave Desert?
California trivia,200,This national park is famous for giant sequoia trees,What is Yosemite National Park?
California trivia,200,This state animal appears on the California state flag,What is the Grizzly Bear?
California trivia,200,This city hosts the Rose Parade and Rose Bowl game,What is Pasadena?
California trivia,200,This famous coastal highway runs along California’s Pacific Coast,What is Highway 1 or Pacific Coast Highway?
California trivia,200,This California city is known for the Hollywood sign,What is Los Angeles?
California trivia,200,This valley produces most of the state’s wine,What is Napa Valley?
California trivia,400,This city is the largest in California by population,What is Los Angeles?
California trivia,400,This fault line runs through much of California and causes earthquakes,What is the San Andreas Fault?
California trivia,400,This mountain range separates California’s Central Valley from the desert,What are the Sierra Nevada Mountains?
California trivia,400,This California city hosted the 1984 Summer Olympics,What is Los Angeles?
California trivia,400,This university is located in Berkeley California,What is the University of California Berkeley?
California trivia,400,This city is home to tech giants like Google and Facebook,What is Mountain View or Menlo Park?
California trivia,400,This theme park in Valencia features roller coasters like Twisted Colossus,What is Six Flags Magic Mountain?
California trivia,400,This California city’s Chinatown is the oldest in North America,What is San Francisco?
California trivia,400,This desert park features Joshua trees,What is Joshua Tree National Park?
California trivia,400,This bay separates San Francisco and Oakland,What is the San Francisco Bay?
California trivia,600,This California city is the seat of the entertainment industry,What is Burbank?
California trivia,600,This region in Northern California is known for redwood forests,What is Humboldt County?
California trivia,600,This city is known as Surf City USA,What is Huntington Beach?
California trivia,600,This mountain is the highest point in the contiguous United States,What is Mount Whitney?
California trivia,600,This gold rush year led thousands to California,What is 1849?
California trivia,600,This California lake is the largest alpine lake in North America,What is Lake Tahoe?
California trivia,600,This island prison in San Francisco Bay was once home to Al Capone,What is Alcatraz Island?
California trivia,600,This city is famous for its canals and boardwalk,What is Venice Beach?
California trivia,600,This Northern California city is known for its State Capitol building,What is Sacramento?
California trivia,600,This scenic drive stretches from Monterey to Morro Bay,What is Big Sur?
California trivia,800,This California city is home to the Getty Center and Griffith Observatory,What is Los Angeles?
California trivia,800,This California region produces most of the nation’s almonds,What is the Central Valley?
California trivia,800,This ghost town in the Sierra Nevada is now a state park,What is Bodie?
